title_x,imdb_id,poster_path,wiki_link,title_y,original_title,is_adult,year_of_release,runtime,genres,imdb_rating,imdb_votes,story,summary,tagline,actors,wins_nominations,release_date
The Ghazi Attack,tt6299040,https://upload.wikimedia.org/wikipedia/en/thumb/e/e7/The_Ghazi_Attack_Poster.jpg/220px-The_Ghazi_Attack_Poster.jpg,https://en.wikipedia.org/wiki/The_Ghazi_Attack_(film),The Ghazi Attack,The Ghazi Attack,0.0,2017,116,Action|Thriller|War,7.6,10332.0,In 1971  amid rising tensions between India and Pakistan over the liberation war of East Pakistan  Pakistan navy  in a top secret mission  plans an attack on Indian majestic-class aircraft carrier INS Vikrant  to gain control over the waters of Bay of Bengal. They send their best-in-class submarine PNS Ghazi  but are intercepted by an Indian submarine INS Karanj (S21). An underwater attack ensues.,A Pakistani submarine  Ghazi plans to secretly attack Vizag port. For doing so  it has to get past Indian submarine S21.,The war you did not know about,Rana Daggubati|Kay Kay Menon|Atul Kulkarni|Om Puri|Nassar|Rahul Singh|Milind Gunaji|Taapsee Pannu|,1 win & 7 nominations,17 February 2017 (USA)
Karar: The Deal,tt3565354,,https://en.wikipedia.org/wiki/Karar:_The_Deal,Karar: The Deal,Karar: The Deal,0.0,2014,115,Thriller,4.3,53.0,Nikita  the granddaughter of a rich and old man  is asthmatic and resides in South Africa. While her family is just about her Dadaji and their care taker Annie  their life changes when Dr. Aryan enters.,Nikita  the granddaughter of a rich and old man  is asthmatic and resides in South Africa. While her family is just about her Dadaji and their care taker Annie  their life changes when Dr. Aryan enters.,Mera jism... Mera hatyaar (My body... My weapon),Mahek Chahal|Tarun Arora|Shashi Wadia|,,21 February 2014 (India)
Aakhari Decision,tt1606162,https://upload.wikimedia.org/wikipedia/en/thumb/5/5f/AakhariDecision2010Poster.jpg/220px-AakhariDecision2010Poster.jpg,https://en.wikipedia.org/wiki/Aakhari_Decision,Aakhari Decision,Aakhari Decision,0.0,2010,\N,Action|Drama|Thriller,6.1,66.0,Arjun is an assassin who operates internationally and works for India-based Victor Chaku. He is in love with Manasi  who wants him to quit  and he accordingly approaches Victor with this request. Victor is willing to conditionally let him quit  and even pay for his marriage  provided he carries out one last assignment. Arjun accepts and accordingly sets out to kill Mumbai Police Commissioner Shyam Singh who is traveling by train to Kaliyapur to visit an ailing friend. Arjun manages to secure a seat opposite Shyam but finds his movements are being monitored by Victor's goon  David D'Souza  who is also on board. Arjun then sets out to carry out his gruesome task not knowing that a passenger  Rajeev Chowdhary  is not who he claims to be.,An assassin  who wants to quit  is asked to carry out a final assignment.,Make the right decision,Paul Sidhu|Sumona Chakravarti|Anant Jog|Nagesh Bhonsle|Rio Kapadia|Navni Parihar|Pradeep Kharab|Curtis Buck|Mushtaq Khan|Shamar Andrew|Kamlesh Sawant|Ghanshyam Garg|,,19 February 2010 (India)
Article 15 (film),tt10324144,https://upload.wikimedia.org/wikipedia/en/thumb/1/11/Article_15_Poster.jpg/220px-Article_15_Poster.jpg,https://en.wikipedia.org/wiki/Article_15_(film),Article 15,Article 15,0.0,2019,130,Crime|Drama,8.3,13417.0,In the rural heartlands of India  an upright police officer sets out on a crusade against violent caste-based crimes and discrimination.,In the rural heartlands of India  an upright police officer sets out on a crusade against violent caste-based crimes and discrimination.,Farq Bahut Kar Liya| Ab Farq Laayenge.,Ayushmann Khurrana|Nassar|Manoj Pahwa|Kumud Mishra|Isha Talwar|Sayani Gupta|Mohammed Zeeshan Ayyub|Subhrajyoti Barat|Sushil Pandey|Aakash Dabhade|Ashish Verma|Ronjini Chakraborty|Veen|Sumbul Touqueer|,1 win,28 June 2019 (USA)
Bullett Raja,tt2551378,https://upload.wikimedia.org/wikipedia/en/thumb/b/b6/Bullett_raja.jpg/220px-Bullett_raja.jpg,https://en.wikipedia.org/wiki/Bullett_Raja,Bullett Raja,Bullett Raja,0.0,2013,138,Action|Crime|Drama,5.0,3508.0,Bullett Raja is the story of a common man  Raja Mishra  who transforms into a dreaded gangster of the Hindi heartland. A victim of the system and chained by it  Raja's life changes as he takes on those that rule and shakes the very foundations of the nexus of the police  the government  and the industrialists. As he rises and revolts against the system becoming an outlaw  Bullett sets ablaze the nexus and changes the landscape forever. The powers that be  fight back in a compelling struggle for power and money against the backdrop of personal ambitions  greed and revenge. Redefining love  friendship and loyalty  Bullet Raja creates a world  where a common man  tests his endurance and fortitude against the very system he once obediently followed and then declared a war on it!,A common man who transforms into a gangster revolts against the very system he once obediently followed by declaring war on the police  the government  and the industrialists.,,Saif Ali Khan|Jimmy Sheirgill|Vidyut Jammwal|Sonakshi Sinha|Raj Babbar|Gulshan Grover|Ravi Kishan|Chunky Pandey|Vipin Sharma|Rishad Rizvi|Gaurav Jha|,2 wins,29 November 2013 (USA)
Lakshmi (2014 film),tt2976176,https://upload.wikimedia.org/wikipedia/en/thumb/5/5a/Nagesh_Kunkunoor_Lakshmi_Film_Movie_Poster.jpg/220px-Nagesh_Kunkunoor_Lakshmi_Film_Movie_Poster.jpg,https://en.wikipedia.org/wiki/Lakshmi_(2014_film),Lakshmi,Lakshmi,0.0,2014,115,Drama,8.0,1240.0,Based on true events  Lakshmi is a story of heroism and untold courage. Lakshmi  a 13 year old girl is kidnapped and sold into prostitution. Thrown into this horrific  inhuman world where she is raped and brutally beaten she barely survives with the help of the other girls and her own will to never give in. Finally she is rescued in a police raid. Against all odds  Lakshmi shows courage where everybody else fails. Resisting all pressure - violent threats  coercion and bribes  she stands up in court and in a landmark case in India  succeeds in putting the traffickers behind bars.,Based on true events  Lakshmi is a story of heroism and untold courage. Lakshmi  a 13 year old girl is kidnapped and sold into prostitution. Thrown into this horrific  inhuman world where ...                    ,A Story of Hope.Courage.Victory,Monali Thakur|,1 win,21 March 2014 (India)
Diwangi Ne Had Kar Di,,https://upload.wikimedia.org/wikipedia/en/3/3a/Diwangi_Ne_Had_Kar_Di.jpg,https://en.wikipedia.org/wiki/Diwangi_Ne_Had_Kar_Di,,,,,,,,,,,,,,
Made in China (2019 film),tt8983180,https://upload.wikimedia.org/wikipedia/en/thumb/3/3e/Made_In_China_poster.jpg/220px-Made_In_China_poster.jpg,https://en.wikipedia.org/wiki/Made_In_China_(2019_film),Made in China,Made in China,0.0,2019,128,Comedy|Drama,6.3,596.0,Story of Failed Gujarati Businessman  who jumps into unknown world of China to get once in a life time business idea  which will change his life.,Story of Failed Gujarati Businessman  who jumps into unknown world of China to get once in a life time business idea  which will change his life.,,Rajkummar Rao|Mouni Roy|Boman Irani|Paresh Rawal|Gajraj Rao|Sumeet Vyas|Amyra Dastur|,,25 October 2019 (USA)
Khwaabb,tt2429930,https://upload.wikimedia.org/wikipedia/en/thumb/3/3d/Khwaabb_poster.jpg/220px-Khwaabb_poster.jpg,https://en.wikipedia.org/wiki/Khwaabb,Khwaabb,Khwaabb,0.0,2014,90,Drama|Romance|Sport,5.6,62.0,Khwaab is a story about the birth of a dream  of ambition and the fierce passion to achieve that dream amidst unceasing tribulations. This intense personal journey is set in the larger  bureaucratic world of Indian sports. It illustrates why a country with a population of 1.2 billion people cannot produce medal-winning athletes. How sheer  raw talent gets wasted or destroyed by corrupt politicians and power hungry bureaucrats. Khwaab is the story of one such athlete and her struggle to succeed in the cut-throat  debauched and mired world of Indian sports.,Khwaab is a story about the birth of a dream  of ambition and the fierce passion to achieve that dream amidst unceasing tribulations. This intense personal journey is set in the larger  ...                    ,Dare To Dream...,Simer Motiani|Navdip Singh|Bajrangbali Singh|Rishi Miglani|Apexa Verma|Jeetendra Gupta|Dhirendra Gupta|Vibhav Bhisht|Abbas Ali Khan|Manoj Bakshi|,,9 May 2014 (India)
Ujda Chaman,tt11046300,https://upload.wikimedia.org/wikipedia/en/thumb/2/23/Ujda_Chaman_Film_Poster.jpg/220px-Ujda_Chaman_Film_Poster.jpg,https://en.wikipedia.org/wiki/Ujda_Chaman,Ujda Chaman,Ujda Chaman,0.0,2019,120,Comedy,8.1,1440.0,Ujda Chaman is about a 30 -year-old bachelor Chaman Kohli  a Hindi lecturer with Premature Balding and in quest of a beautiful wife. After facing several rejections as a prospective groom because of his baldness  Chaman hits rock bottom when an astrologer gives him a deadline to find himself a wife or remain a celibate forever. This leads Chaman on a Funny and emotional roller coaster ride of self-discovery and acceptance.,Ujda Chaman is about a 30 -year-old bachelor Chaman Kohli  a Hindi lecturer with Premature Balding and in quest of a beautiful wife. After facing several rejections as a prospective groom ...                    ,,Sunny Singh Nijjar|Maanvi Gagroo|Saurabh Shukla|Atul Kumar|Grusha Kapoor|Gagan Arora|Karishma Sharma|,,1 November 2019 (USA)
Breakaway (2011 film),tt1736552,https://upload.wikimedia.org/wikipedia/en/thumb/7/73/Breakaway2011Poster.jpg/220px-Breakaway2011Poster.jpg,https://en.wikipedia.org/wiki/Speedy_Singhs,Breakaway,Breakaway,0.0,2011,101,Comedy|Drama|Sport,5.7,2123.0,A hockey enthusiast since 12 years of age  Toronto-based Rajvinder Singh  even went to the extent of trimming his hair  discarding his Pagri/turban  did not complete his education  incurred the wrath of his father  Darvesh  who wanted him to be involved in the family business as well as confirm and respect Sikh religion principles and values. Hoping to play professional hockey  Rajvinder  along with other fellow Sikh players  instead finds himself treated as the object of ridicule  referred to as a 'joker'  by mainstream Caucasian players. Even his friends tease him and ask him to take up 'Guli Danda' and Kabaddi'  while his father makes him work for Uncle Sammy as a truck driver. He is attracted to stunning law student Melissa Winters while her brother  Dan  offers to coach Rajvinder and his team. Unable to get themselves included in any team  they form their own  and call it 'Speedy Singhs'. They then set about to make a name for themselves with a coach who is unable to pronounce ...,An ethnic Canadian hockey player struggles against traditional family values and discrimination from mainstream hockey players.,Love. It's a team sport.,Vinay Virmani|Camilla Belle|Russell Peters|Rob Lowe|Anupam Kher|Gurpreet Ghuggi|Sakina Jaffrey|Noureen DeWulf|Kashish Suri|Pamela Sinha|Prem Singh|Al Mukadam|Ali Hassan|Rup Magon|,,23 September 2011 (India)
Anna (2016 film),tt6118134,https://upload.wikimedia.org/wikipedia/en/thumb/9/93/Anna_%282016_film%29.jpg/220px-Anna_%282016_film%29.jpg,https://en.wikipedia.org/wiki/Anna_(2016_film),Anna,Anna,0.0,2016,142,Biography,4.9,38.0,"Indian biographical film based on the life of social activist  Kisan Baburao ""Anna"" Hazare.","Indian biographical film based on the life of social activist  Kisan Baburao ""Anna"" Hazare.",,Shashank Udapurkar|Tanishaa Mukerji|Govind Namdeo|Rajit Kapoor|Sharat Saxena|Daya Shankar Pandey|Atul Srivastava|Anant Jog|Arif Zakaria|Kishore Kadam|,,14 October 2016 (India)
Bombay Velvet,tt2979920,https://upload.wikimedia.org/wikipedia/en/thumb/0/05/Bombay_Velvet_poster.jpg/220px-Bombay_Velvet_poster.jpg,https://en.wikipedia.org/wiki/Bombay_Velvet,Bombay Velvet,Bombay Velvet,0.0,2015,149,Action|Crime|Drama,5.7,5116.0,Set against the backdrop of ambition  love  greed  and jazz - Bombay Velvet is the story of one ordinary man who goes against all odds and forges his destiny to become a 'Big Shot'. Jazz clubs  a passionate love story  a growing metropolis and a phenomenal hunger for a good life. Welcome to the City of Dreams. Welcome to Bombay Velvet.,An ordinary man goes against all odds and forges his destiny to become a 'Big Shot'.,,Ranbir Kapoor|Anushka Sharma|Karan Johar|Satyadeep Misra|Manish Chaudhary|Kay Kay Menon|Siddartha Basu|Vivaan Shah|Vicky Kaushal|Atul Srivastava|Akash Dabas|Jagdish Rajpurohit|Varun Grover|Sandesh Jadhav|,3 wins & 3 nominations,15 May 2015 (USA)
Nautanki Saala!,tt2341766,https://upload.wikimedia.org/wikipedia/en/thumb/0/0f/Nautankisaalaposter.jpg/220px-Nautankisaalaposter.jpg,https://en.wikipedia.org/wiki/Nautanki_Saala,Nautanki Saala!,Nautanki Saala!,0.0,2013,119,Comedy,5.8,3891.0,An actor's life changes dramatically when he saves a stranger from suicide.,An actor's life changes dramatically when he saves a stranger from suicide.,,Ayushmann Khurrana|Kunaal Roy Kapur|Pooja Salvi|Gaelyn Mendonca|Sanjeev Bhatt|Evelyn Sharma|Rufy Khan|Sulabha Arya|Purva Naresh|Nipun Dharmadhikari|Sheela Das|Vishwajeet|,,12 April 2013 (India)
Gulabi Gang (film),tt2196638,https://upload.wikimedia.org/wikipedia/en/thumb/a/af/Gulabi_Gang_Documentary_Film_Poster.jpg/220px-Gulabi_Gang_Documentary_Film_Poster.jpg,https://en.wikipedia.org/wiki/Gulabi_Gang_(film),Gulabi Gang,Gulabi Gang,0.0,2012,96,Documentary,7.5,195.0,Bundelkhand in central India  a region notorious for its rebels-turned-armed bandits  is witnessing a new kind of rebellion with an unusual cast of characters. These are the pink sari-clad women of the Gulabi Gang  who use words as weapons - demanding their rights  submitting petitions and haranguing corrupt officials. They travel long distances by cart and tractor  bus and train  to wrest justice for women and dalits  undeterred by sneering policemen and condescending bureaucrats. Sampat Pal  the group's founder  is a rough-and-tough woman with a commanding personality. Despite being born into a traditional family and married off early  she has evolved her own brand of feminism and egalitarian politics. Constantly on the move  today she may be found investigating the suspicious death of a young woman  tomorrow protesting against a corrupt official. The Gulabi Gang  with a membership of thousands  is active across many districts. Suman Singh  one of the leaders  has made it her ...,In Bundelkhand  India  a revolution is in the making among the poorest of the poor  as the fiery women of the Gulabi Gang empower themselves and take up the fight against gender violence  caste oppression and widespread corruption.,,Sampat Pal Devi|Ram Dulari|Devrati|Babu|Soondhi|Chandrakali|Bharat Patel|Hemlata Patel|Husna Jahan|Jayprakash Shivhare|Usha Patel|Suman Singh Chauhan|Parvati|Gomati|,7 wins & 2 nominations,February 2014 (India)
Masaan,tt4635372,https://upload.wikimedia.org/wikipedia/en/thumb/1/1c/Masaan_poster.jpg/220px-Masaan_poster.jpg,https://en.wikipedia.org/wiki/Fly_Away_Solo,Masaan,Masaan,0.0,2015,109,Drama,8.1,19904.0,Four lives intersect along the Ganges: a low caste boy hopelessly in love  a daughter ridden with guilt of a sexual encounter ending in a tragedy  a hapless father with fading morality  and a spirited child yearning for a family  long to escape the moral constructs of a small-town.,Four lives intersect along the Ganges: a low caste boy hopelessly in love  a daughter ridden with guilt of a sexual encounter ending in a tragedy  a hapless father with fading morality  and...                    ,Paths of grieve intersect on the Ganges River.,Richa Chadha|Sanjay Mishra|Vicky Kaushal|Pankaj Tripathi|Vineet Kumar|Bhagwan Tiwari|Bhupesh Singh|Satya Kam Anand|Saurabh Chadhary|,20 wins & 5 nominations,24 July 2015 (India)
Yaara Silly Silly,tt5052972,https://upload.wikimedia.org/wikipedia/en/thumb/d/d8/Yaara_Silly_Silly_-_Poster.jpg/220px-Yaara_Silly_Silly_-_Poster.jpg,https://en.wikipedia.org/wiki/Yaara_Silly_Silly,Yaara Silly Silly,Yaara Silly Silly,0.0,2015,108,Romance,5.6,214.0,,,,,,
Dear Zindagi,tt5946128,https://upload.wikimedia.org/wikipedia/en/9/9e/Dear_Zindagi_poster.jpg,https://en.wikipedia.org/wiki/Dear_Zindagi,Dear Zindagi,Dear Zindagi,0.0,2016,151,Drama|Romance,7.6,32790.0,This is the story of Kaira  a budding cinematographer in search of perfect life. A chance encounter with Jug  an unconventional thinker  helps her gain new perspective about life. She discovers that happiness is all about finding comfort in life's imperfections.,Kaira is a budding cinematographer in search of a perfect life. Her encounter with Jug  an unconventional thinker  helps her gain a new perspective on life. She discovers that happiness is all about finding comfort in life's imperfections.,,Alia Bhatt|Shah Rukh Khan|Kunal Kapoor|Priyanka Moodley|Prateek Jain|Aditya Roy Kapoor|Ali Zafar|Bobby Duggal|Angad Bedi|Darwin|Raj Bhansali|Sharic Sequeira|Dilip|Akanksha Gade|,8 nominations,23 November 2016 (USA)
Sabki Bajegi Band,tt4654760,https://upload.wikimedia.org/wikipedia/en/thumb/b/b4/Sabki_Bajegi_Band_Official_First_Look.jpg/220px-Sabki_Bajegi_Band_Official_First_Look.jpg,https://en.wikipedia.org/wiki/Sabki_Bajegi_Band,Sabki Bajegi Band,Sabki Bajegi Band,0.0,2015,108,Comedy|Drama,5.3,35.0,The film is based on true events - when the controversial RJ Anirudh recorded candid conversations between his celebrity/Bollywood pals at a farmhouse party: their intimate sexual desires  kinks  rivalries  affairs and bitching about Bollywood. The sensational uncensored footage has become India's First Reality Film.,The film is based on true events - when the controversial RJ Anirudh recorded candid conversations between his celebrity/Bollywood pals at a farmhouse party: their intimate sexual desires  ...                    ,,Swara Bhaskar|Shaurya Chauhan|Jhanvi Desai|Nisha Lalwani|Alekh Sangal|Samarth Shandilya|Aman Uppal|Sumeet Vyas|,,1 May 2015 (India)
Patiala House (film),tt1535467,https://upload.wikimedia.org/wikipedia/en/thumb/3/3d/Patiala_House_1.jpg/220px-Patiala_House_1.jpg,https://en.wikipedia.org/wiki/Patiala_House_(film),Patiala House,Patiala House,0.0,2011,140,Drama|Sport,5.6,8301.0,Gurtej Singh Kahlon witnesses his family being attacked by British-born Caucasian skinheads  leading to a death in the family. While the identified attackers were never charged by racially biased police  he himself was arrested for defending his family. He swore to change the manner in which East Indians were profiled and set about to build a Mini-India in Southall. He encourages his son  Parghat  to play and excel in cricket as he himself was a fan of the Indian team  especially Lala and his son  Mohinder Ambarnath. But when the time comes for Parghat to be inducted in the English cricket team  he forbids him  gets him to manage a convenience store  and also sets about to arrange marriages and lives of his family with no daring to oppose him. Then mixed-raced Simran Chaggal enters Parghat's life  and with some help from the Kahlon family  gets him to be included in a failing English team. They conspire to keep this information from Gurtej  and even re-name Parghat as 'Kaali'. But it ...,A victim of British racial violence and profiling prevents his son from playing cricket.,,Rishi Kapoor|Dimple Kapadia|Akshay Kumar|Anushka Sharma|Tinnu Anand|Soni Razdan|Prem Chopra|Masood Akhtar|Jeneva Talwar|Suparna Marwah|Neelu Kohli|Rabbit|Armaan Kirmani|Maya Sarao|,,11 February 2011 (India)
Queen (2014 film),tt3322420,https://upload.wikimedia.org/wikipedia/en/thumb/4/45/QueenMoviePoster7thMarch.jpg/220px-QueenMoviePoster7thMarch.jpg,https://en.wikipedia.org/wiki/Queen_(2014_film),Queen,Queen,0.0,2013,146,Comedy|Drama,8.2,56406.0,Queen is a movie about growing up. Rani (Kangana Ranaut) is a Delhi girl from a conservative family who is ditched by her fiancé just before her wedding. Shocked by this  she decides to set out on the planned honeymoon alone. As she travels the world and meets new people  she gains new experiences and discovers her own identity.,A Delhi girl from a traditional family sets out on a solo honeymoon after her marriage gets cancelled.,Everything in life happens for the good.,Kangana Ranaut|Rajkummar Rao|Lisa Haydon|Jeffrey Ho|Marco Canadea|Guithob Joseph|Yogendra Tiku|Alka Badola Kaushal|Tripta Lakhanpal|Chinmay Chandraunshuh|Nayani Dixit|Sabeeka Imam|Ayaan Malik|Ramesh Kalra|,21 wins & 14 nominations,7 March 2014 (India)
Chakravyuh (2012 film),tt2292625,https://upload.wikimedia.org/wikipedia/en/thumb/3/3f/Chakravyuh.jpg/220px-Chakravyuh.jpg,https://en.wikipedia.org/wiki/Chakravyuh_(2012_film),Chakravyuh,Chakravyuh,0.0,2012,152,Action|Drama|Thriller,6.8,2876.0,On the request of his friend Kabir  SP Adil Sends him to the Naxal group as an informer. When Kabir finds the truth he becomes one of their gang leader.,On the request of his friend Kabir  SP Adil Sends him to the Naxal group as an informer. When Kabir finds the truth he becomes one of their gang leader.,,Arjun Rampal|Abhay Deol|Manoj Bajpayee|Esha Gupta|Om Puri|Kabir Bedi|Deep Raj Rana|Harsh Mainra|,1 nomination,24 October 2012 (India)
Union Leader (film),tt6395306,https://upload.wikimedia.org/wikipedia/en/thumb/0/01/Union_Leader_Poster.jpg/220px-Union_Leader_Poster.jpg,https://en.wikipedia.org/wiki/Union_Leader_(film),Union Leader,Union Leader,0.0,2017,106,Drama,7.6,1503.0,UNION LEADER is a drama  105 minutes in length  and it is the story of Jay  who gave up his dream of education to care for his family when he was young and is haunted by the loss of a future that was not to be. But  he is determined to end the cycle of poverty and provide a better life for his family. Jay must fight to keep his family alive with each passing minute. Living in poverty and faced with the looming possibility of death  Jay must struggle against corporate greed and the constant dangers of living on every last penny. Will Jay be able to fulfill his dream? Will Jay be able to bring the bad guys to justice? Will Jay survive  or will he fall to his death like the hundreds that do.,Resigned to his fate as a worker in a notoriously shoddy chemical plant  Jay realizes that he must not only find a way to support his family  but also overcome grave social and legal injustice in the system.,,Rahul Bhat|Tillotama Shome|,3 wins & 17 nominations,19 January 2018 (India)
Yaaram (2019 film),tt11007050,https://upload.wikimedia.org/wikipedia/en/thumb/8/8e/Yaaram_film_poster.jpg/220px-Yaaram_film_poster.jpg,https://en.wikipedia.org/wiki/Yaaram_(2019_film),#Yaaram,#Yaaram,0.0,2019,\N,Comedy|Romance,5.7,7.0,All set for an arranged marriage  Rohit Bajaj is faced with a rather strange request from his Muslim friend Sahil. As per halala  he convinces Rohit to get hitched to his ex-wife  just for him to remarry her. This twisted tale of love turns into a sour dose of betrayal - all this and more  in the name of friendship.,All set for an arranged marriage  Rohit Bajaj is faced with a rather strange request from his Muslim friend Sahil. As per halala  he convinces Rohit to get hitched to his ex-wife  just for ...                    ,,Siddhanth Kapoor|Prateik|Anita Raj|Ishita Raj|Subha Rajput|Natasha Stankovic|,,
Tanu Weds Manu,tt1694542,https://upload.wikimedia.org/wikipedia/en/thumb/c/c6/Tanuwedsmanu.jpg/220px-Tanuwedsmanu.jpg,https://en.wikipedia.org/wiki/Tanu_Weds_Manu,Tanu Weds Manu,Tanu Weds Manu,0.0,2011,113,Comedy|Drama|Romance,6.7,12091.0,London-based Dr. Manoj Sharma returns home to Delhi  and in the company of his parents  Kishan and Anju  as well as several others  travels to Chaman Ganj  Kanpur  Uttar Pradesh to meet his prospective bride  Tanuja Trivedi. He approves of her  informs his elders and they begin preparations for the marriage. Subsequently he gets a rude awakening when Tanuja tells him that she already has a boyfriend and plans to marry him even against her parents' wishes. Manoj informs his parents  and they set about to see other girls for their son - albeit in vain - as he has his heart set on Tanuja  and is all set to return back unmarried. Manoj and Tanuja are fated to meet again in Kapurthala  Punjab  while attending the marriage of Jaspreet Singh Jassi and Payal Sinha. While Manoj hopes to win Tanuja's heart - he will face more rejection when she enlists his assistance to elope with another male.,Manu comes to India to find a bride for himself and falls for Tanu at first sight but Tanu  a free spirited girl has no plans of marrying him.,Celebrate a perfect mismatch,Madhavan|Kangana Ranaut|Jimmy Sheirgill|Deepak Dobriyal|Swara Bhaskar|Eijaz Khan|K.K. Raina|Rajendra Gupta|Navni Parihar|Dipti Misra|,1 win & 7 nominations,25 February 2011 (India)
Life Mein Twist Hai,,https://upload.wikimedia.org/wikipedia/en/1/10/Life_Mein_Twist_Hai.jpg,https://en.wikipedia.org/wiki/Life_Mein_Twist_Hai,,,,,,,,,,,,,,
