title_x,imdb_id,poster_path,wiki_link,title_y,original_title,is_adult,year_of_release,runtime,genres,imdb_rating,imdb_votes,story,summary,tagline,actors,wins_nominations,release_date
Second Hand Husband,tt3948240,https://upload.wikimedia.org/wikipedia/en/thumb/9/98/Second_Hand_Husband_-_Poster.jpg/220px-Second_Hand_Husband_-_Poster.jpg,https://en.wikipedia.org/wiki/Second_Hand_Husband,Second Hand Husband,Second Hand Husband,0.0,2015,105,Comedy,3.8,141.0,Gurpreet and Rajbir are in love and want to marry each other. The only thing stopping them is the alimony that Rajbir has to pay every month to his ex-wife  Neha. Gurpreet  being a lawyer  is aware that the alimony needs to be paid only till Neha gets married to somebody else. Thus  begins the two lovers' journey to find a suitable groom for Rajbir's ex-wife! Their comic journey goes through various twists and turns and finally culminates at a point where Rajbir's boss  Ajit Singh (Dharmendra)  gets into trouble with his wife because of his flirtatious ways. What is the special in the special appearance of Mr. Aman Pathela and Is there a ray of hope here for Gurpreet and Rajbir? Can they manipulate their way out of this mess?,Gurpreet and Rajbir are in love and want to marry each other. The only thing stopping them is the alimony that Rajbir has to pay every month to his ex-wife  Neha. Gurpreet  being a lawyer  ...                    ,,Dharmendra|Vijay Raaz|Sanjay Mishra|Gippy Grewal|Ravi Kishan|Alok Nath|Gurpreet Ghuggi|Rati Agnihotri|Supriya Karnik|Geeta Basra|Tina Ahuja|Mukesh Tiwari|Karamjit Anmol|Rubina|,,3 July 2015 (India)
Aiyyaa,tt2255934,https://upload.wikimedia.org/wikipedia/en/thumb/5/56/Aiyyaa_poster.jpg/220px-Aiyyaa_poster.jpg,https://en.wikipedia.org/wiki/Aiyyaa,Aiyyaa,Aiyyaa,0.0,2012,152,Comedy|Romance,4.3,1571.0,Wildly imaginative and film-obsessed  Meenakshi Deshpande has an extra sensitive nose. After she is hired to work in a local college's library  she catches a wonderful scent in the air. The source is Surya  a handsome and enigmatic art student from a Tamil family. Meanwhile  Meenakshi's eccentric Marathi family has arranged for her marriage to Madhav  a kind and sensible man. Meenakshi is torn between marrying her parents' choice for a seemingly ideal husband  or following her nose and chasing the hunky stranger who may or may not be all that he seems.,A woman goes on the hunt for her dream man  armed with her wild imagination  her passion for Masala-films  and her ultra-sensitive sense of smell.,Go wakda (Go crooked/wacky),Rani Mukerji|Prithviraj Sukumaran|Nirmiti Sawant|Subodh Bhave|Jyoti Subhash|Satish Alekar|Anita Date|Amey Wagh|Kishori Ballal|Thamizh|Shubhangi Damle|Umesh Kulkarni|Suraj Satav|Prashant Tapaswi|,4 nominations,12 October 2012 (India)
Behen Hogi Teri,tt6537508,https://upload.wikimedia.org/wikipedia/en/thumb/c/c0/Behen_Hogi_Teri_poster.jpg/220px-Behen_Hogi_Teri_poster.jpg,https://en.wikipedia.org/wiki/Behen_Hogi_Teri,Behen Hogi Teri,Behen Hogi Teri,0.0,2017,128,Comedy,5.5,1514.0,Gattu (Rajkummar Rao) has a problem  he loves Binny (Shruti Haasan) who lives in their neighborhood. But everyone says that the girls of the neighborhood should be treated as own sister or mother. So no one considers Gattu as a potential groom for Binny  rather gives him tasks which are usually done by a brother for his sister. Binny is also very mischievous  she is not committing to Gattu entirely. Now we have to watch how Gattu convinces both Binny and the neighborhood.,Gattu (Rajkummar Rao) has a problem  he loves Binny (Shruti Haasan) who lives in their neighborhood. But everyone says that the girls of the neighborhood should be treated as own sister or ...                    ,,Rajkummar Rao|Shruti Haasan|Gautam Gulati|Darshan Jariwala|Ninad Kamat|Ranjeet|,,9 June 2017 (India)
Do Lafzon Ki Kahani (film),tt4857886,https://upload.wikimedia.org/wikipedia/en/thumb/9/9a/Do_Lafzon_Ki_Kahani_Poster.jpg/220px-Do_Lafzon_Ki_Kahani_Poster.jpg,https://en.wikipedia.org/wiki/Do_Lafzon_Ki_Kahani_(film),Do Lafzon Ki Kahani,Do Lafzon Ki Kahani,0.0,2016,128,Action|Drama|Romance,6.4,1201.0,Centered on ex-mixed martial arts artist Sooraj (Randeep Hooda) and sculptor artist Jenny (Kajal Aggarwal). Their fate intertwines when their past are revealed in their blooming relationship.,Centered on ex-mixed martial arts artist Sooraj (Randeep Hooda) and sculptor artist Jenny (Kajal Aggarwal). Their fate intertwines when their past are revealed in their blooming relationship.,,Kajal Aggarwal|Anil George|Randeep Hooda|Snehal Kulshreshtha|Mamik Singh|,,10 June 2016 (India)
Married 2 America,tt2158633,,https://en.wikipedia.org/wiki/Married_2_America,Married 2 America,Married 2 America,0.0,2012,\N,Thriller,4.3,14.0,Ravi Malhotra  an NRI living in the US  works for the mighty Larson & Jason  a US based multinational  which builds huge civil projects throughout the world like dams & bridges. One of its recent contracts was in India  the Dharbhanga Dam project in Bihar at District Saurabhpur... it was planned & executed with a hundred year warranty  by their top architect & engineer Ravi Malhotra. But within a few years three of the dam's gates are burst open  leaving hundreds of people dead  thousands are rendered homeless & public property worth crores washed down in floods. The Indian government is contemplating suing the company for damages worth millions. The company sends Ravi Malhotra to India to probe & investigate what exactly caused the damage. Ravi finds out the shocking truth & hands over the file to the concerned authorities here. Since that night he goes missing. The authorities & the police feel he has escaped to evade arrest as the Indian government & the law holds Ravi & his ...,Anjali Malhotra comes to India in search of her husband. But she has to face corruption everywhere and is left clueless about the mystery of her missing husband.,,Archana Joglekar|Akhilendra Mishra|Chetan Pandit|Ashok Samarth|Jackie Shroff|Shweta Tiwari|Ganesh Yadav|,,
Finding Fanny,tt3142688,https://upload.wikimedia.org/wikipedia/en/thumb/0/0c/Finding_Fanny.jpg/220px-Finding_Fanny.jpg,https://en.wikipedia.org/wiki/Finding_Fanny,Finding Fanny,Finding Fanny,0.0,2014,102,Adventure|Comedy|Drama,5.8,5897.0,Late one night  an undelivered letter is returned to postmaster and singer Ferdinand 'Ferdie' Pinto. He realizes that his one true love Stefanie 'Fanny' Fernandes never received the marriage proposal he sent to her forty-six years earlier. Angie  a young widow and Ferdie's dear friend suggests they go on a road trip to find Fanny. Joining them on the journey is Rosie  Angie's mother-in-law; and Don Pedro  an artists who is keen to paint Rosie. Driving the car is Savio  the childhood friend whose heart Angie broke six years earlier when she married another.,A man embarks on a road trip to find his lost love.,If you're looking for love...get lost!,Deepika Padukone|Naseeruddin Shah|Basilo Dias|Kevin D'Mello|Urcelina Mascarenhas|Dimple Kapadia|Ankur Tewari|Anjali Patil|Ranveer Singh|Meher Verma|Pankaj Kapur|Anand Tiwari|Arjun Kapoor|Libert Olivera|,1 win & 23 nominations,12 September 2014 (USA)
Double Dhamaal,tt1728239,https://upload.wikimedia.org/wikipedia/en/thumb/c/ca/Double_dhamaal.jpg/220px-Double_dhamaal.jpg,https://en.wikipedia.org/wiki/Double_Dhamaal,Double Dhamaal,Double Dhamaal,0.0,2011,138,Comedy|Crime|Drama,3.8,3105.0,After losing a huge sum to a police officer  Kabir Nayak; four slackers: Aditya Shrivastav  Boman Contractor  Manav Shrivastav and Deshbandhu Roy find themselves unemployed and broke. Then they come upon Kabir  who apparently lives a wealthy lifestyle now along with his wife  Kamini  and sister  Kiya. They intrude in his life  find out he is having an affair with a woman named Gulabo  and blackmail him into making them partners. They also rope in a gangster-turned-Sadhu  Bata Bhai  into investing in an oil project - but are humiliated and go on the run after finding that Kabir has conned them. With an enraged Bata on their tail  the hapless foursome manage to escape to Macau with the help of a gangster  Mohsin Bhai. It is here they will run into Kabir - who is now the owner of 'Four Jokers' Casino - and make elaborate plans to avenge their humiliation as well as ensure that he winds up alone and penniless.,Four slackers decide to avenge their humiliation at the hands of a con-man.,,Sanjay Dutt|Riteish Deshmukh|Arshad Warsi|Javed Jaffrey|Aashish Chaudhary|Mallika Sherawat|Kangana Ranaut|Satish Kaushik|Zakir Hussain|,1 win & 1 nomination,1 July 2011 (USA)
Mastram,tt3431714,https://upload.wikimedia.org/wikipedia/en/thumb/2/25/Mastram_poster.jpg/220px-Mastram_poster.jpg,https://en.wikipedia.org/wiki/Mastram,Mastram,Mastram,0.0,2013,98,Biography|Drama,4.8,414.0,How a clerk became an erotica writer.,How a clerk became an erotica writer.,,Rahul Bagga|Tara-Alisha Berry|Aakash Dahiya|Istiyak Khan|Aishwarya Mehta|Vinod Nahardih|,,9 May 2014 (India)
Tanu Weds Manu: Returns,tt2140465,https://upload.wikimedia.org/wikipedia/en/thumb/3/3f/Tanu_weds_Manu_poster.jpg/220px-Tanu_weds_Manu_poster.jpg,https://en.wikipedia.org/wiki/Tanu_Weds_Manu_Returns,Tanu Weds Manu Returns,Tanu Weds Manu Returns,0.0,2015,128,Comedy|Drama|Romance,7.7,24338.0,Tanu and Manu's marriage collapses. What happens when Manu meets Tanu's lookalike Kusum - and when Tanu returns?,Tanu and Manu's marriage collapses. What happens when Manu meets Tanu's lookalike Kusum - and when Tanu returns?,,Kangana Ranaut|Madhavan|Jimmy Sheirgill|Swara Bhaskar|Rajesh Sharma|Mohammed Zeeshan Ayyub|Eijaz Khan|Deepak Dobriyal|Manu Rishi Chadha|Raj Awasti|Gaurav Mishra|Aakash Dahiya|Alex Jaep|,11 wins & 15 nominations,22 May 2015 (USA)
Luv U Soniyo,tt2188811,https://upload.wikimedia.org/wikipedia/en/thumb/b/b6/Luv_U_Soniyo.Jpeg/220px-Luv_U_Soniyo.Jpeg,https://en.wikipedia.org/wiki/Luv_U_Soniyo,Luv U Soniyo,Luv U Soniyo,0.0,2012,144,Comedy|Romance,5.5,63.0,Mark & Soniyo  who after having been brought together by fate have to win over their parents consent. Their cultures clash in every possible way & just when fate decides to turn the game around  all they have is their faith in each other & a little help from their friends.,Mark & Soniyo  after having been brought together by fate  have to win over their parents consent.,,Tanuj Virwani|Neha Hinge|Bunty Grewal|Shobhit Khanduri|Vivek Vaswani|Howard Rosemeyer|Suresh Menon|Aditya Shivkumar|,,26 July 2013 (India)
Mittal v/s Mittal,tt1607607,https://upload.wikimedia.org/wikipedia/en/thumb/a/ad/MvsM.jpg/220px-MvsM.jpg,https://en.wikipedia.org/wiki/Mittal_v/s_Mittal,Mittal v/s Mittal,Mittal v/s Mittal,0.0,2010,\N,Drama,4.8,9.0,Girls have dreams - dreams of a fairytale romance  of prince charming sweeping them off their feet  a dream wedding and living happily ever-after. Mitali  a successful model  also had dreams... Then one day she met Karan  the Mittal scion  the heir to one of the richest families in the country. Mitali 's simple  middle-class upbringing is in complete contrast to Karan's super-brat lifestyle. But Karan was smitten by Mitali. Accustomed to getting what he wants in life  Karan landed up at Mitali's home with his parents with a marriage proposal. Delighted at their daughter's luck  Mitali's family approved of the match. And Mitali entered Karan's home and life as his newly-wedded bride. It was not long before Mitali's dreams turned into her worst nightmare. Her mother-in-law detested her and created misunderstandings between Karan and her. Karan turned out to be a puppet in his mother's hands and her father-in-law is a helpless  mute spectator. Karan has a certain pattern of dealing with ...,Girls have dreams - dreams of a fairytale romance  of prince charming sweeping them off their feet  a dream wedding and living happily ever-after. Mitali  a successful model  also had ...                    ,,Hazel Croney|Gulshan Grover|Iravati Harshe|Suchitra Krishnamoorthi|Reema Lagoo|Rohit Roy|Rituparna Sengupta|Anjan Srivastav|Amar Talwar|,,19 March 2010 (India)
Zila Ghaziabad,tt2171454,https://upload.wikimedia.org/wikipedia/en/thumb/9/9e/Zilla_Ghaziabad.jpg/220px-Zilla_Ghaziabad.jpg,https://en.wikipedia.org/wiki/Zilla_Ghaziabad,Zila Ghaziabad,Zila Ghaziabad,0.0,2013,142,Action|Crime|Thriller,3.5,1187.0,In the city of Ghaziabad  gang war breaks between two rival groups led by Satbir Singh and Fauji. Thakur Pritam Singh  a corrupt police officer  is transferred to the city to handle the situation.,In the city of Ghaziabad  gang war breaks between two rival groups led by Satbir Singh and Fauji. Thakur Pritam Singh  a corrupt police officer  is transferred to the city to handle the situation.,,Vivek Oberoi|Sanjay Dutt|Arshad Warsi|Paresh Rawal|Ravi Kishan|Ashutosh Rana|Minissha Lamba|Divya Dutta|Sunil Grover|Charmy Kaur|Ashutosh Kaushik|Eijaz Khan|Anil Nagrath|Shriya Saran|,,22 February 2013 (India)
Aarakshan,tt1848771,https://upload.wikimedia.org/wikipedia/en/thumb/3/38/Aarakshan.jpg/220px-Aarakshan.jpg,https://en.wikipedia.org/wiki/Aarakshan,Aarakshan,Aarakshan,0.0,2011,164,Drama,6.2,4629.0,Following the Mandal Commission report and the Supreme Court of India's decision to maintain a 27 percent reservation for Dalits and lower/backward castes  right-winged political parties organize protests. The Principal of Shakuntala Thakral Mahavidyalal  a non-government college which is exempt from this mandate  gets in the limelight when it's Principal  Prabhakar Anand  endorses the decision - much to the ire of the trustees as well as the newly appointed Vice-Principal Mithilesh Singh  who has invested Rs.1200 Crores in private coaching classes. Prabhakar refuses to change his stand and ends up tendering his resignation  taking his family  consisting of his wife  Kavita and daughter  Poorbi  to live near Shambhu Yadav's Tabela after they find their family home being taken over by Mithilesh's coaching classes. Attempts to evict Mithilesh's staff will be in vain and will not only end up alienating the family from everyone but Prabhakar will also be summoned and possibly arrested for...,A decision by India's supreme court tests a man's friendships and loyalty.,,Amitabh Bachchan|Saif Ali Khan|Manoj Bajpayee|Deepika Padukone|Prateik|Tanvi Azmi|Saurabh Shukla|Darshan Jariwala|Yashpal Sharma|Mukesh Tiwari|Rajeev Verma|S.M. Zaheer|Chetan Pandit|Vinay Apte|,2 wins & 7 nominations,12 August 2011 (USA)
Roar: Tigers of the Sundarbans,tt3796006,https://upload.wikimedia.org/wikipedia/en/thumb/9/93/Poster_2-_Roar.jpg/220px-Poster_2-_Roar.jpg,https://en.wikipedia.org/wiki/Roar_(2014_film),ROAR: Tigers of the Sundarbans,ROAR: Tigers of the Sundarbans,0.0,2014,123,Action|Adventure|Sci-Fi,5.7,639.0,After his photojournalist brother gets killed by a white tigress in the jungles of the Sundarbans  Pandit and his team of commandos enter the prohibited core area of the forest to avenge his death.,After his photojournalist brother gets killed by a white tigress in the jungles of the Sundarbans  Pandit and his team of commandos enter the prohibited core area of the forest to avenge his death.,,Aadil Chahal|Ahran Chaudhary|Pranay Dixit|Subrat Dutta|Nora Fatehi|Virendra Singh Ghuman|Achint Kaur|Ali Quli Mirza|Abhinav Shukla|,1 win & 2 nominations,31 October 2014 (India)
Ladies vs Ricky Bahl,tt1954598,https://upload.wikimedia.org/wikipedia/en/thumb/5/53/LadiesVsRickyBahl2.jpg/220px-LadiesVsRickyBahl2.jpg,https://en.wikipedia.org/wiki/Ladies_vs_Ricky_Bahl,Ladies vs. Ricky Bahl,Ladies vs. Ricky Bahl,0.0,2011,140,Comedy|Drama|Romance,5.9,8069.0,Dimple Chaddha (Parineeti Chopra)  a brash 19 year old Delhi college girl falls in love with Sunny Singh  a fitness trainer. Raina Parulekar (Dipannita Sharma)  a 28 year old independent and successful corporate woman in Mumbai does business with an art dealer Deven Shah. Saira Rashid (Aditi Sharma)  a 24 year old sweet  hard working widow in Lucknow makes a new friend  the shy Iqbal Khan. Three very different girls who each get taken for a lot of money by each of these three men. The problem is that it is actually just one man - Ricky Bahl (Ranveer Singh)  a suave and charming con-man who revels in the game and is only after the Money. A chance encounter brings these three women together who vow to take down Ricky Bahl and get their money back. The next step is the actual plan. Enter Ishika Desai (Anushka Sharma)  a young and ambitious girl whose street smart ways will one day  very soon  get her to the top. The furious trio  one professional con-man and a girl who loves adventure. ...,"A smooth and charming conman  Ricky Bahl  cons girls for a living but finally meets his match is this fun-filled ""ROM-CON.""",,Ranveer Singh|Anushka Sharma|Parineeti Chopra|Dipannita Sharma|Aditi Sharma|,7 wins & 3 nominations,9 December 2011 (India)
Jhalki,tt7743400,https://upload.wikimedia.org/wikipedia/en/thumb/e/e3/Jhalki_Movie_Official_Poster.jpg/220px-Jhalki_Movie_Official_Poster.jpg,https://en.wikipedia.org/wiki/Jhalki,Jhalki,Jhalki,0.0,2019,\N,Drama,,,A life-altering disappearance of her 7-year old brother sets Jhalki off on a mission to find him at all costs. Armed with an intimate folk-tale and her own sharp mind  is Jhalki's journey the start of a spiral that will change the lives of thousands for good? What price must she pay to get what she wants? Inspired by true events  with a backdrop of human-trafficking and child-labour  Jhalki becomes an atypical thriller of hope  courage  self-belief and perseverance  seen through the eyes of a 9-year-old girl  who will not stop anywhere short of a triumph.,A life-altering disappearance of her 7-year old brother sets Jhalki off on a mission to find him at all costs. Armed with an intimate folk-tale and her own sharp mind  is Jhalki's journey ...                    ,,Boman Irani|Tannishtha Chatterjee|Divya Dutta|Sanjay Suri|Akhilendra Mishra|Govind Namdeo|Yatin Karyekar|Joy Sengupta|Sailesh Dubey|Bachan Pachehra|Sanchita Goswami|Goraksha Sakpal|Vikram Singh|Aarti Jha|,,
7 Khoon Maaf,tt1629376,https://upload.wikimedia.org/wikipedia/en/thumb/f/f9/7KhoonMaaf_poster_ver1.jpg/220px-7KhoonMaaf_poster_ver1.jpg,https://en.wikipedia.org/wiki/7_Khoon_Maaf,Seven Sins Forgiven,7 Khoon Maaf,0.0,2011,137,Drama|Mystery|Thriller,6.1,5059.0,After the passing of his Pondicherry-born mentor  Susanna  Mumbai-based Dr. Arun Kumar Singh narrates his story to his wife  Nalini. With photographs from an old album that he has never shared with anyone  he informs her as to how Susanna caught him stealing; got him to quit his job & enrolled in a Panchgani school  as well as arranged for further education in St. Petersburg. While Susanna herself searched for true love and her marriages with six deceased men - including the abusive Major Edwin Rodrigies; drug-addicted and womanizer guitarist-singer Jamshed Singh Rathore; impotent and abusive Mohammad Wasiullah Khan; bigamist/spy Nicolai Vronski; Inspector Keemat Lal; and Dr. Modhusodon Tarafdar - men who influenced her life  broke her heart - and met with sudden and mysterious deaths.,Susanna's quest for love leads to a series of marriages  each ending in the mysterious death of her latest husband.,,Priyanka Chopra|Vivaan Shah|Neil Nitin Mukesh|John Abraham|Irrfan Khan|Konkona Sen Sharma|Alexander Diachenko|Shashi Malviya|Annu Kapoor|Naseeruddin Shah|Usha Uthup|Manuj Bhaskar|Harish Khanna|Ayush Tandon|,5 wins & 10 nominations,18 February 2011 (USA)
Katti Batti,tt4467262,https://upload.wikimedia.org/wikipedia/en/thumb/f/f8/Katti-Batti-Poster-2015.jpg/220px-Katti-Batti-Poster-2015.jpg,https://en.wikipedia.org/wiki/Katti_Batti,Katti Batti,Katti Batti,0.0,2015,135,Comedy|Drama|Romance,4.9,2543.0,Katti Batti is an anti-love story starring Imran Khan as Madhav Kabra (Maddy) & Kangana Ranaut as Payal. Maddy is an architect who is in love with Payal because of her attitude towards life. The story revolves around Maddy & Payal's live-in relationship for 5 years until a sudden turn of events when Payal leaves Maddy mid-way!,A romantic comedy that follows Maddy and Payal's live-in relationship until a sudden turn of events creates a distance between them.,,Suhaas Ahuja|Vivan Bhatena|Imran Khan|Suparna Marwah|Gavin N. Methalaka|Mithila Palkar|Jimesh Patel|Chandan Raina|Kangana Ranaut|Abhishek Saha|,,18 September 2015 (USA)
Bajrangi Bhaijaan,tt3863552,https://upload.wikimedia.org/wikipedia/en/thumb/d/dd/Bajrangi_Bhaijaan_Poster.jpg/220px-Bajrangi_Bhaijaan_Poster.jpg,https://en.wikipedia.org/wiki/Bajrangi_Bhaijaan,Bajrangi Bhaijaan,Bajrangi Bhaijaan,0.0,2015,163,Action|Comedy|Drama,8.0,65877.0,A little mute girl from a Pakistani village gets lost on her return back from a trip to India. In Kurukshetra  she meets Pawan - an ardent devotee of Lord Hanuman - who is in the midst of a challenge posed by his lover's father. In trying to discover the girl's parents  he develops an unshakable bond with her. He tries to get into Pakistan through a path righteous to his conscience and later  accompanied with a smart Pakistani news reporter - a story that captures the imagination of the public in both countries.,An Indian man with a magnanimous heart takes a young mute Pakistani girl back to her homeland to reunite her with her family.,,Salman Khan|Harshaali Malhotra|Nawazuddin Siddiqui|Kareena Kapoor|Sharat Saxena|Alka Badola Kaushal|Om Puri|Meher Vij|Rajesh Sharma|Mir Sarwar|Khushaal Pawar|Krunal Pandit|Manoj Bakshi|Mursaleem Qureshi|,25 wins & 13 nominations,17 July 2015 (USA)
Raabta (film),tt5542802,https://upload.wikimedia.org/wikipedia/en/thumb/8/8b/Raabta_poster.jpg/220px-Raabta_poster.jpg,https://en.wikipedia.org/wiki/Raabta_(film),Raabta,Raabta,0.0,2017,147,Action|Adventure|Drama,4.1,2667.0,In 2017  Shiv and Saira fall for each other and form an inseparable connection. Until  Saira crosses paths with a reincarnated lover from a previous lifetime who is determined to make her his lover again.,In 2017  Shiv and Saira fall for each other and form an inseparable connection. Until  Saira crosses paths with a reincarnated lover from a previous lifetime who is determined to make her his lover again.,,Deepika Padukone|Kriti Sanon|Sushant Singh Rajput|Rajkummar Rao|Varun Sharma|Jim Sarbh|Vikas Verma|Karan Singh Chhabra|Suneel Sinha|Manpreet Toor|Rina Fatania|Nidhi Subbaiah|Rachita Singh|Jashan Singh Kohli|,1 win & 1 nomination,9 June 2017 (USA)
Bazaar E Husn,tt3854246,https://upload.wikimedia.org/wikipedia/en/thumb/6/6d/Poster_Of_Bazaar_E_Husn.jpg/220px-Poster_Of_Bazaar_E_Husn.jpg,https://en.wikipedia.org/wiki/Bazaar_E_Husn,Bazaar E Husn,Bazaar E Husn,0.0,2014,125,Drama,5.0,12.0,Bazaar-e-Husn is a film based on Munshi Premchand's novel Bazaar E Husn. The story revolves around Suman  a courtesan. Brought up by an honest Police Inspector  Suman's life goes through all kinds of turmoil. From being harassed for dowry to becoming a victim of domestic abuse  Suman suffers a lot but at the end rises like a phoenix. How did a simpleton like Suman end up as a courtesan? How does she break free from all the difficulties in her life? Bazaar-e-Husn answers all these questions and more beautifully.,Bazaar-e-Husn is a film based on Munshi Premchand's novel Bazaar E Husn. The story revolves around Suman  a courtesan. Brought up by an honest Police Inspector  Suman's life goes through ...                    ,,Reshmi Ghosh|Jeet Goswami|Om Puri|Rajeshwari Sachdev|Virendra Saxena|Yashpal Sharma|Upasna Singh|,,18 July 2014 (India)
Tanu Weds Manu: Returns,tt2140465,https://upload.wikimedia.org/wikipedia/en/thumb/3/3f/Tanu_weds_Manu_poster.jpg/220px-Tanu_weds_Manu_poster.jpg,https://en.wikipedia.org/wiki/Tanu_Weds_Manu:_Returns,Tanu Weds Manu Returns,Tanu Weds Manu Returns,0.0,2015,128,Comedy|Drama|Romance,7.7,24338.0,Tanu and Manu's marriage collapses. What happens when Manu meets Tanu's lookalike Kusum - and when Tanu returns?,Tanu and Manu's marriage collapses. What happens when Manu meets Tanu's lookalike Kusum - and when Tanu returns?,,Kangana Ranaut|Madhavan|Jimmy Sheirgill|Swara Bhaskar|Rajesh Sharma|Mohammed Zeeshan Ayyub|Eijaz Khan|Deepak Dobriyal|Manu Rishi Chadha|Raj Awasti|Gaurav Mishra|Aakash Dahiya|Alex Jaep|,11 wins & 15 nominations,22 May 2015 (USA)
Paathshaala,tt1194236,https://upload.wikimedia.org/wikipedia/en/thumb/5/55/Paathshaala1.jpg/220px-Paathshaala1.jpg,https://en.wikipedia.org/wiki/Paathshaala,Paathshaala,Get Educated: Paathshaala,0.0,2010,122,Drama|Family,4.9,1413.0,Rahul Prakash Udyavar joins Saraswati Vidya Mandir  which is located in Mumbai's Eastern suburbs  as an English Teacher. Shortly thereafter he also agrees to teach music at the request of Nutritionist  Anjali Mathur. With the school facing shortage of funds  pressure is being brought by Manager Lallan Sharma to try to get students' parents to pay more for a variety of activities. When the Principal  Aditya Sahay  supports Lallan  the students and staff are forced to raise funds. Despite of their best efforts  however  a stage will be set for a much-publicized confrontation that may well result in the closure of this institution.,A new English school-teacher also teaches music but ends up leading both teachers and students to revolt against the school management.,,Nana Patekar|Shahid Kapoor|Ayesha Takia|Sushant Singh|Saurabh Shukla|Anjan Srivastav|Kurush Deboo|Sanatan Mody|Shraddha Arya|Kainaz Motivala|Dwij Yadav|Swini Khara|Ali Haji|,,16 April 2010 (India)
