title_x,imdb_id,poster_path,wiki_link,title_y,original_title,is_adult,year_of_release,runtime,genres,imdb_rating,imdb_votes,story,summary,tagline,actors,wins_nominations,release_date
Yeh Dooriyan,tt1826051,https://upload.wikimedia.org/wikipedia/en/9/98/Yeh_Dooriyan.jpg,https://en.wikipedia.org/wiki/Yeh_Dooriyan,Yeh Dooriyan,Yeh Dooriyan,0.0,2011,107,Drama|Romance,5.1,68.0,This is the story of a strong 35 year old beautiful and a famous choreographer divorced with two kids  living alone and is forced by her peers and family to remarry and find a father for her kids. She promises that she will marry any guy that loves her children as much as her.,A divorced businesswoman with two children falls in love with a much younger man.,Love after divorce......is it a crime?,Deepshika Nagpal|Inder Kumar|Delnaaz Irani|Chitrashi Rawat|Kunickaa Sadanand|Achint Kaur|Rajesh Khera|Shishir Sharma|Anita Wahi|Ayub Khan|Baby Vidhir|Master Vivak|Kaishav Arora|,,26 August 2011 (India)
Murder 3,tt2429640,https://upload.wikimedia.org/wikipedia/en/thumb/3/3f/Murder_3.jpg/220px-Murder_3.jpg,https://en.wikipedia.org/wiki/Murder_3,Murder 3,Murder 3,0.0,2013,124,Drama|Mystery|Thriller,4.9,2182.0,A hot-shot fashion and wildlife photographer Vikram gets into a relationship with Nisha. She moves in with him in his palatial house outside of the city. The old world house  made decades ago is as beautiful as it is scary. It holds many secrets which Nisha is soon to unearth; of the life of the man who made it and of Vikram  who is dealing with the mysterious disappearance of his former girlfriend Roshni.,A hot-shot fashion and wildlife photographer Vikram gets into a relationship with Nisha. She moves in with him in his palatial house outside of the city. The old world house  made decades ...                    ,,Randeep Hooda|Aditi Rao Hydari|,,15 February 2013 (India)
Gang of Ghosts,tt3531604,https://upload.wikimedia.org/wikipedia/en/thumb/a/ac/Gang_Of_Ghosts%2C_Official_Poster%2C_2014.jpg/220px-Gang_Of_Ghosts%2C_Official_Poster%2C_2014.jpg,https://en.wikipedia.org/wiki/Gang_of_Ghosts,Gang of Ghosts,Gang of Ghosts,0.0,2014,128,Comedy|Horror,3.6,320.0,A story about a group of ghosts who have lost their shelter due to urbanization. The story starts with a struggling wannabe director who somehow crosses paths with a stranger. The stranger starts to narrate a story to him about a group of ghosts that stays together. The story that the stranger narrates shows the communal  social  linguistic and historical differences among the ghosts  as they belong to different eras. But very soon these ghosts face an issue protecting their haunt from the hands of demolition.,A story about a group of ghosts who have lost their shelter due to urbanization. The story starts with a struggling wannabe director who somehow crosses paths with a stranger. The stranger ...                    ,Bhutiapanti,Sharman Joshi|Mahie Gill|,,21 March 2014 (India)
Krishna Aur Kans,tt2321492,https://upload.wikimedia.org/wikipedia/en/thumb/b/b8/KRISHNA_AUR_KANS.gif/220px-KRISHNA_AUR_KANS.gif,https://en.wikipedia.org/wiki/Krishna_Aur_Kans,Krishna Aur Kans,Krishna Aur Kans,0.0,2012,117,Action|Adventure|Animation,6.3,157.0,"It is the story of Krishna  the destiny's child  born as the nemesis of brutal king Kans who had tormented the kingdom with his ruthless dominance. Growing up as a naughty prankster  Krishna from a very early age displays his valiant powers over the deadly demons send by Kans  whose frustrations grow as every death defying duel hails Krishna emerging as a real hero among his folks. Years of futile efforts to eliminate his nemesis at last compels Kans to invite Krishna for a decisive duel in the coliseum as the massive crowd breathlessly witnesses the final faceoff between good and evil. As an epic magnum opus  ""Krishna aur Kans"" promises a complete entertainment package. The pace and speed of the film aptly support the emergence of Krishna  the greatest legendary heritage character of India  that manages to keep the graph of excitement soaring till the end. Adding another magic touch to the package is the heartwarming music of the film. Krishna aur Kans as an animated feature film ...",Hailed as India's first stereoscopic animated film  'Krishna Aur Kans' is an exciting narrative full of action and drama. The movie chronicles Krishna's early years -- from his birth as the nemesis of his tyrannical uncle Kans.,,Manoj Bajpayee|Harish Bhimani|Neetu Chaudhary|Juhi Chawla|Kenneth Desai|Meghna Erande|Meena Goculdas|A.K. Hangal|Ninad Kamat|Jameel Khan|Mukesh Khanna|Anupam Kher|Vinod Kulkarni|Rahul Mulani|,,3 August 2012 (India)
Kesari (film),tt6264938,https://upload.wikimedia.org/wikipedia/en/thumb/c/c4/Kesari_poster.jpg/220px-Kesari_poster.jpg,https://en.wikipedia.org/wiki/Kesari_(film),Kesari,Kesari,0.0,2019,150,Action|Drama|History,7.4,10653.0,This period war-drama showcases the 1897 Battle of Saragarhi. The plot focuses on Havildar Ishar Singh who led a platoon of 21 Sikhs against an invading army of 10 000 Afghans to defend the North-West Frontier Province. The event is considered as one of the greatest last-stands in history.,Based on an incredible true story of the Battle of Saragarhi in which an army of 21 Sikhs fought against 10 000 Afghans in 1897.,,Akshay Kumar|Parineeti Chopra|Suvinder Vicky|Vansh Bhardwaj|Sumeet Basran|Ajit Singh|Sandeep Nahar|Harwinder Singh Aujla|Rakesh Sharma|Adhrit Sharma|Vivek Saini|Harbhagwan Singh|Rajdeep Singh Dhaliwal|Gurpreet Toti|,,21 March 2019 (USA)
Setters (film),tt9239772,https://upload.wikimedia.org/wikipedia/en/thumb/0/08/Setters_Official_Poster.png/220px-Setters_Official_Poster.png,https://en.wikipedia.org/wiki/Setters_(film),Setters,Setters,0.0,2019,126,Thriller,5.1,158.0,"A thriller set in Benares  Jaipur  Mumbai and Delhi  Setters is about a racket profiteering from academic scams. The film follows a cat-and-mouse game between two good friends: one a cop  and the other a ""setter"" who arranges brilliant students in place of weak students to appear in examinations.",A thriller set in Benares  Jaipur  Mumbai and Delhi  Setters is about a racket profiteering from academic scams. The film follows a cat-and-mouse game between two good friends: one a cop  ...                    ,,Shreyas Talpade|Aftab Shivdasani|Sonnalli Seygall|Ishita Dutta|Pavan Malhotra|Vijay Raaz|Manu Rishi Chadha|Anil Charanjeett|Pankaj Jha|Jameel Khan|Niharika Kundu|Tanuka Laghate|Venus Singh|Neeraj Sood|,,3 May 2019 (India)
M Cream,tt2963974,https://upload.wikimedia.org/wikipedia/commons/thumb/7/7c/MCR_Theatrical_Poster.jpg/220px-MCR_Theatrical_Poster.jpg,https://en.wikipedia.org/wiki/M_Cream,M Cream,M Cream,0.0,2014,112,Adventure|Comedy|Drama,5.7,590.0,FIGS is the typical cynic one finds lurking in the expansive lawns of Delhi University. Entangled in a web of drugged out delirium  he's the quintessential rebel. His world is thrown into disarray when his conservative parents begin to chalk out a strategy for his future. Things only become worse when a sudden scarcity of hash deprives Figs of his favorite pastime. Unable to cope with the situation  Figs joins forces with his best friend MAGGIE on a quest to attain M Cream  a mythical form of hash. They hastily devise a plan to trek to the far reaches of the Himalayas in pursuit of this goal. Maggie ropes in her boyfriend NIZ  who's purportedly headed to the hills on a photo assignment. Unbeknownst to Figs  the trio is joined by JAY  a close friend of Niz. Chaos ensues as the reckless travelers journey across the Himalayan expanse. The road trip results in a series of unexpected encounters that begin to unravel the myriad realities of rebellion. Difficult choices are made and ...,A motley crew of university students set out on a journey in pursuit of a mythical form of hash  confronting a series of encounters that begin to unravel the myriad realities of rebellion.,,Tom Alter|Raaghav Chanana|Ira Dubey|Lushin Dubey|Auritra Ghosh|Rahil Gilani|Barry John|Santosh Ojha|Beatrice Ordeix|Lili Rocha|Imaaduddin Shah|,4 wins,22 July 2016 (India)
Thackeray (film),tt7777196,https://upload.wikimedia.org/wikipedia/en/thumb/8/8e/Thackeray_film_poster.jpeg/220px-Thackeray_film_poster.jpeg,https://en.wikipedia.org/wiki/Thackeray_(film),Thackeray,Thackeray,0.0,2019,120,Biography|Drama,5.1,2301.0,Balasaheb Thackrey works as a cartoonist for a newspaper. But his editor isn't happy with it as he creates cartoons of politician which affects the sales of his paper.He is asked to try something else but he quits his job and now his only aim is to fight for the rights of Marathi people. He sees that Marathi people don't have any respect and are made to do all odd works. With a few people  he starts to help the needy and gains respect. To fight for the rights he also goes against the law and comes in the eye of politics. After entering politics he starts his own party named after Shivaji Maharaj as Shiv Sena. After giving Marathi Manoos his equal rights his only wish is that one day the Chief Minister of Maharashtra should be a Marathi Manoos.,Biographical account of Shiv Sena Supremo  Balasaheb Thackeray.,,Nawazuddin Siddiqui|Amrita Rao|Abdul Quadir Amin|Sanjay Narvekar|Prakash Belawadi|Vineet Sharma|Radha Sagar|Sonamoni Jayant Gadekar|Satish Alekar|Micky Makhija|Nikhil Mahajan|Resh Lamba|Jaywant Wadkar|Laxman Singh Rajput|,,25 January 2019 (India)
Samrat & Co.,tt3636776,https://upload.wikimedia.org/wikipedia/en/thumb/5/51/Samrat_%26_Co_%E2%80%94_poster.jpg/220px-Samrat_%26_Co_%E2%80%94_poster.jpg,https://en.wikipedia.org/wiki/Samrat_%26_Co.,Samrat & Co.,Samrat & Co.,0.0,2014,125,Mystery|Thriller,6.3,1013.0,A young  beautiful and rich girl  Dimpy Singh (Madalsa Sharma)  approaches Samrat Tilakdhari (Rajeev Khandelwal)  a private investigator  with a strange case. How will Samrat unfold the mysteries? Will there be more mysteries while he is investigating? Will the case be solved?,A small town tycoon gets murdered. The daughter hires a private investigator to catch the real culprit.,Get Ready for the Dilchasp Rahasya Ride,Rajeev Khandelwal|Madalsa Sharma|Gopal Dutt|Girish Karnad|Priyanshu Chatterjee|Shreya Narayan|Indraneil Sengupta|Barkha Bisht|Ravi Jhankal|Puja Gupta|Rajniesh Duggall|Bhaumik Sampat|Pradeep Welankar|Smita Jaykar|,,25 April 2014 (India)
Kya Dilli Kya Lahore,tt2063745,https://upload.wikimedia.org/wikipedia/en/9/9f/Kya_dilli_kya_lahore_the_movie.jpg,https://en.wikipedia.org/wiki/Kya_Dilli_Kya_Lahore,Kya Dilli Kya Lahore,Kya Dilli Kya Lahore,0.0,2014,98,Drama|History|War,7.4,1761.0,In 1948  a cross-fire erupts at an isolated stretch of Indo-Pak border  leaving only two soldiers alive. One is an Indian soldier of Pakistani origin while the other happens to be a Pakistani soldier of Indian origin. An ironic story of pride and survival begins when - in an attempt to evade danger  they bump into each other. And amidst continuous exchange of bullets  altercations and murkier situations  it evolves into a journey of human connection with an unforeseeable end.,In 1948  a cross-fire erupts at an isolated stretch of Indo-Pak border  leaving only two soldiers alive. One is an Indian soldier of Pakistani origin while the other happens to be a ...                    ,,Vijay Raaz|Manu Rishi Chadha|Raj Zutshi|,,2 May 2014 (India)
Chaar Din Ki Chandni,tt2191641,,https://en.wikipedia.org/wiki/Chaar_Din_Ki_Chandni,Chaar Din Ki Chandni,Chaar Din Ki Chandni,0.0,2012,131,Comedy|Romance,4.1,374.0,Chandini comes to India to attend Veer's sisters wedding. In those four days  she wins everyone's heart.,Chandini comes to India to attend Veer's sisters wedding. In those four days  she wins everyone's heart.,,Tusshar Kapoor|Kulraj Randhawa|Anupam Kher|Om Puri|Johnny Lever|Anita Raj|Farida Jalal|Harish|Chandrachur Singh|Sushant Singh|Mukul Dev|Avtar Gill|Rahul Singh|Hemant Pandey|,,9 March 2012 (India)
Dream Girl (2019 film),tt9248940,https://upload.wikimedia.org/wikipedia/en/thumb/6/6e/Dream_Girl.png/220px-Dream_Girl.png,https://en.wikipedia.org/wiki/Dream_Girl_(2019_film),Dream Girl,Dream Girl,0.0,2019,132,Comedy|Romance,7.5,4077.0,Rom-com Movie  directed by Raaj Shaandilyaa  stars Ayushmann Khurrana who plays a 'dream girl'. In every love story  there is always one trying to win the heart of the other  who could be the 'dream girl'.,Rom-com Movie  directed by Raaj Shaandilyaa  stars Ayushmann Khurrana who plays a 'dream girl'. In every love story  there is always one trying to win the heart of the other  who could be the 'dream girl'.,,Ayushmann Khurrana|Nushrat Bharucha|Annu Kapoor|Raj Bhansali|Manjot Singh|,,13 September 2019 (USA)
Break Ke Baad,tt1578261,https://upload.wikimedia.org/wikipedia/en/thumb/f/f2/Break_Ke_Baad_first_look_poster.jpg/220px-Break_Ke_Baad_first_look_poster.jpg,https://en.wikipedia.org/wiki/Break_Ke_Baad,Break Ke Baad,Break Ke Baad,0.0,2010,118,Comedy|Drama|Romance,5.2,3714.0,Mumbai-based Aaliya Khan and Abhay Gulati have been close friends for over a decade but Aaliya is not prepared to take this relationship to a marriage. Instead  without any warning  she decides to re-locate to Australia  to live with her aunt. Upon arrival  she finds her aunt very stern and organized  and ends up moving out to live with Nadia and Cyrus. Concerned about her safety  Abhay travels there but gets a lukewarm reception. She takes to acting  while he drives a taxi and then starts selling home-made food. He eventually returns home and takes Aaliya totally by surprise when she finds out that he is getting married.,Childhood friends Abhay and Aaliya experience plenty of obstacles in their paths as they find their way in the world and back to each other.,,Deepika Padukone|Imran Khan|Lillete Dubey|Sharmila Tagore|Shahana Goswami|Navin Nischol|Parzaan Dastur|Neelu Kohli|Yudhishtir Urs|Gaurav Nanda|Ziyah Vastani|,2 nominations,26 November 2010 (USA)
Thanks Maa,tt1437367,https://upload.wikimedia.org/wikipedia/en/thumb/1/1b/ThanksMaa2010Poster.jpg/220px-ThanksMaa2010Poster.jpg,https://en.wikipedia.org/wiki/Thanks_Maa,Thanks Maa,Thanks Maa,0.0,2009,120,Crime|Drama,8.0,666.0,While on the run from the reformatory  a 12 year old boy named Municipality finds and saves a two day old abandoned baby from becoming the prey to a ferocious street dog. Failing to find any takers among the people whom he deemed responsible and respectable  Municipality takes up the onus of finding the mother of that abandoned baby himself. Municipality's rock steady determination ultimately helps him emerge a winner against all odds as he reaches that baby's mother but in bargain he loses his most precious possession  the flawless and god-like image of a mother he used to see in his dreams and probably the hope that he'll ever find his own mother again.,A homeless petty thief attempts to find the biological mother of an abandoned baby.,,Master Shams|Master Salman|Master Jaffer|Master Fayaaz|Baby Almas|,,5 March 2010 (India)
Shaadi Ke Side Effects,tt3302962,https://upload.wikimedia.org/wikipedia/en/thumb/4/4f/Shaadi_ke_side_effects.jpg/220px-Shaadi_ke_side_effects.jpg,https://en.wikipedia.org/wiki/Shaadi_Ke_Side_Effects,Shaadi Ke Side Effects,Shaadi Ke Side Effects,0.0,2014,145,Comedy|Romance,5.6,3613.0,Sid and Trisha are happily married couple until they find out that they are having a baby. This changes everything for both of them; specially Sid. Life is getting difficult and boring for Sid day by day until he discovers a key to success in family life from a friend who is know for his brilliant performances as a father and a husband. He too begins to follow his lead and enters in to a two-way life style. In a one he is a great father and a husband and in his secret life he is enjoying his life as he used to enjoy in his bachelor life. Everything goes perfectly well until a third person enters to their life. From that point onward Sid's marriage life is moving toward a disaster. He tries his best to save it for the sake of his child. He finally understands how important his wife and child for him.,A complicated relationship develops between a man and woman after getting married and having a baby.,,Farhan Akhtar|Vidya Balan|Vir Das|Ram Kapoor|Gautami Kapoor|Rati Agnihotri|Ila Arun|Purab Kohli|,,28 February 2014 (India)
Sooper Se Ooper,tt3005850,https://upload.wikimedia.org/wikipedia/en/thumb/1/1c/Sooper_Se_Ooper_Theatrical_Poster_%282013%29.jpg/220px-Sooper_Se_Ooper_Theatrical_Poster_%282013%29.jpg,https://en.wikipedia.org/wiki/Sooper_Se_Ooper,Sooper Se Ooper,Sooper Se Ooper,0.0,2013,\N,Comedy,4.3,156.0,A city guy goes to rural Rajasthan to look for his uncle.,A city guy goes to rural Rajasthan to look for his uncle.,,Tinnu Anand|Mahesh Balraj|Mithilesh Chaturvedi|Vir Das|Deepak Dobriyal|Gulshan Grover|Mohan Kapoor|Kirti Kulhari|Yashpal Sharma|,,25 October 2013 (India)
Wajah Tum Ho,tt5638474,https://upload.wikimedia.org/wikipedia/en/thumb/f/f1/Sana_Khan%27s_Wajah_Tum_Ho_poster.jpg/220px-Sana_Khan%27s_Wajah_Tum_Ho_poster.jpg,https://en.wikipedia.org/wiki/Wajah_Tum_Ho,Wajah Tum Ho,Wajah Tum Ho,0.0,2016,136,Drama|Mystery|Romance,4.3,1000.0,A TV channel owned by Rahul Oberoi is hacked and the murder of police officer Ramesh Sarnaik is broadcast live. Rahul is interrogated by inspector Kabir Deshmukh of Mumbai police and defended by his lawyer Sia whose boyfriend Ranveer is the prosecution lawyer. During the investigation  police find Karan Parekh  Rahul's old business partner  to be the suspect but before they could get hold of him Karan's murder is also telecast live on the same channel. Kabir now has to find a link which joins Rahul  Karan and Sarnaik which is leading to the murders.,People get entangled in a mystery when a murder is committed on live television.,From the makers of Hate Story 2 & 3.,Sharman Joshi|Sana Khaan|Gurmeet Choudhary|Rajniesh Duggall|Himmanshoo A. Malhotra|Prarthana Behere|Sherlyn Chopra|Zareen Khan|,,16 December 2016 (India)
Heartless (2014 film),tt3334348,https://upload.wikimedia.org/wikipedia/en/thumb/0/07/Heartless_2014%2C_official_poster.jpg/220px-Heartless_2014%2C_official_poster.jpg,https://en.wikipedia.org/wiki/Heartless_(2014_film),Heartless,Heartless,0.0,2014,131,Drama|Family|Romance,5.2,429.0,A young man  Aditya Singh (Adhyayan)  who fell deeply in love with a beautiful girl (Ariana). Soon he had a severe heart-attack  and when consulted with his doctor-friend (Shekhar Suman)  he then suggested him to do a heart-transplant. As Aditya lands in the operation theatre  some bizarre thing happens in his life  and lots of unsaid and controversial betrayed story unfolds.,A young man  Aditya Singh (Adhyayan)  who fell deeply in love with a beautiful girl (Ariana). Soon he had a severe heart-attack  and when consulted with his doctor-friend (Shekhar Suman)  ...                    ,,Adhyayan Suman|Ariana Ayam|Deepti Naval|Om Puri|Shekhar Suman|,1 nomination,7 February 2014 (India)
Staying Alive (2012 film),tt2188893,https://upload.wikimedia.org/wikipedia/en/thumb/c/c0/Staying_Alive.jpg/220px-Staying_Alive.jpg,https://en.wikipedia.org/wiki/Staying_Alive_(2012_film),Staying Alive,Staying Alive,0.0,2012,89,Drama,5.7,26.0,A newspaper sub-editor  Aditya (Ananth Mahadevan) suffers his third heart attack and finds himself in the ICU of a hospital. On the bed next to him is Shaukat Ali (Saurabh Shukla)  a gangster who has suffered his first heart attack. While Aditya scoffs at death  Ali is terrified of dying. The movie is his journey of realising death is inevitable and the greatest feeling is to simply be alive.,A newspaper sub-editor  Aditya (Ananth Mahadevan) suffers his third heart attack and finds himself in the ICU of a hospital. On the bed next to him is Shaukat Ali (Saurabh Shukla)  a ...                    ,,Jahangir Khan|Ananth Narayan Mahadevan|Navni Parihar|Chandan Sanyal|Ranjana Sasan|Saurabh Shukla|,,3 February 2012 (India)
Firangi,tt7549484,https://upload.wikimedia.org/wikipedia/en/thumb/a/af/Firangi_-_Poster_1.jpg/220px-Firangi_-_Poster_1.jpg,https://en.wikipedia.org/wiki/Firangi,Firangi,Firangi,0.0,2017,158,Comedy|Drama,4.5,913.0,Manga  an unemployed young man from village Behrampur  was born with a healing gift through which he could cure anyone's backache. This unique ability of his helps him get the job of Orderly from British Officer Mark Daniels. During a visit to village Naku Guda for his friend Heera's wedding  Manga comes across Sargi and falls in love with her. Manga's parents visit Sargi's house with a marriage proposal but Lalaji  Sargi's grandfather  who is not happy with Manga working for the Britishers  refuses the proposal. Raja Inderveer Singh asks all the people of village Naku Guda to relocate to some other place as he intends to set up a Distillery there. Sensing an opportunity to impress Lalaji  Manga decides to help the villagers and complains about it to Officer Mark Daniels  unaware of the fact that his officer is in cahoots with Raja Inderveer Singh. An unsuspecting Manga is manipulated by Mark Daniels and Raja Inderveer Singh and ends up helping them deceive the villagers. Now the ...,When there are disputes in life  love overcomes all challenges and truth prevails. Set in the colonial era  Firangi is the story of a mutiny staged by the villagers against the Britishers.,,Kapil Sharma|Ishita Dutta|Monica Gill|Edward Sonnenblick|Kumud Mishra|Anjan Srivastav|Inaamulhaq|Rajesh Sharma|Jameel Khan|Jatinder Kaur|Vishal Om Prakash|Roshni Walia|Naisha Khanna|Sharan Makkar|,1 nomination,1 December 2017 (USA)
Love Breakups Zindagi,tt1877691,https://upload.wikimedia.org/wikipedia/en/thumb/d/dd/LBZ_pic.jpg/220px-LBZ_pic.jpg,https://en.wikipedia.org/wiki/Love_Breakups_Zindagi,Love Breakups Zindagi,Love Breakups Zindagi,0.0,2011,156,Comedy|Drama|Romance,5.7,930.0,Delhi-based Jai Malhotra is engaged to Radhika and their marriage is expected to take place soon  while Mumbai-based Naina Kapoor has a boyfriend in Dhruv and both are also plan to wed. Both travel without their respective lovers to Chandigarh to attend the marriage of Arjun and Gayatri. They meet with Gayatri's grandmother  Bijji  and mingle with others. They also organize a night of entertainment  which is also attended by Dhruv. The festivities turn to sorrow the next day when Bijji unexpectedly passes away. After a brief mourning period  the marriage takes place  and everyone returns to their respective homes. With their minds still fresh from memories and photographs from the wedding  they then experience issues and challenges when they attempt to adjust back into their respective lives.,A couple and many of their friends experience changes and challenges in their respective lives after attending a wedding.,,Zayed Khan|Dia Mirza|Cyrus Sahukar|Tisca Chopra|Satyadeep Misra|Vaibhav Talwar|Pallavi Sharda|Auritra Ghosh|Umang Jain|Farida Jalal|,,7 October 2011 (India)
Hate Story 4,tt5325684,https://upload.wikimedia.org/wikipedia/en/thumb/9/9a/Hate_Story_4_Official_Poster.jpg/220px-Hate_Story_4_Official_Poster.jpg,https://en.wikipedia.org/wiki/Hate_Story_4,Hate Story IV,Hate Story IV,0.0,2018,131,Crime|Drama|Thriller,3.3,1203.0,London based Aryan and Rajveer are son of business tycoon Vikram Khurana.Aryan is handling the family business and is looking out for a new female face for his campaign.He is in love with Rishma whose also looking after his business.Rajveer is a womanizer and professional photographer who approaches Taasha to be the model of their campaign.Taasha soon becomes a star and both brothers fall in love with her.Which leads Aryan to murder Rishma after she finds about his relationship with Taasha.After Aaryan and Taasha dispose Rishma's body it is reveled that Taasha is not who she claims and has come to revenge against Khurana's.,London based Aryan and Rajveer are son of business tycoon Vikram Khurana.Aryan is handling the family business and is looking out for a new female face for his campaign.He is in love with ...                    ,Hate is coming.,Lee Byford|Urvashi Rautela|Gulshan Grover|Vaunisha Kapoor|Lee Nicholas Harris|Ty Hurley|Komal Chhabria|Shaad Randhawa|Atul Sharma|Manoj Anand|Daniel Eghan|Tia Bajpai|Vivan Bhatena|Swaylee Loughnane|,,9 March 2018 (India)
Daas Dev,tt4979110,https://upload.wikimedia.org/wikipedia/en/thumb/4/41/Flag_of_India.svg/32px-Flag_of_India.svg.png,https://en.wikipedia.org/wiki/Aur_Devdas,Daas Dev,Daas Dev,0.0,2018,140,Drama|Thriller,5.1,205.0,Daas Dev is a 2018 romantic-thriller  with an interesting  modern take on the classic tale of DevDas-Paro-Chandramukhi love triangle  starring Rahul Bhat as Dev  the supremely talented Richa Chadda as Paro  and Aditi Rao Hydari as Chandni.,Daas Dev is a 2018 romantic-thriller  with an interesting  modern take on the classic tale of DevDas-Paro-Chandramukhi love triangle  starring Rahul Bhat as Dev  the supremely talented Richa Chadda as Paro  and Aditi Rao Hydari as Chandni.,,Yogesh Raj Mishra|,,27 April 2018 (India)
Jayantabhai Ki Luv Story,tt2622130,https://upload.wikimedia.org/wikipedia/en/thumb/a/a7/Jayanta_Bhai.jpg/220px-Jayanta_Bhai.jpg,https://en.wikipedia.org/wiki/Jayantabhai_Ki_Luv_Story,Jayantabhai Ki Luv Story,Jayantabhai Ki Luv Story,0.0,2013,130,Action|Comedy|Romance,5.3,1143.0,Jayantabhai is a street-thug and small time gangster  who unexpectedly falls in love with his enemy  who is Simrin. A romantic caper about how people unknowingly fall in love with people they least expect to.,Jayantabhai is a street-thug and small time gangster  who unexpectedly falls in love with his enemy  who is Simrin. A romantic caper about how people unknowingly fall in love with people they least expect to.,Luvgiri more danger than Bhaigiri!,Vivek Oberoi|Neha Sharma|Rahul Singh|Nikhil Ratnaparkhi|Shishir Sharma|Him Dayal Singh|Vishwanath Chatterjee|Jiten Mukhi|Falguni Rajani|Nilofer Raza|,,15 February 2013 (India)
